[
  {
    "name": "Amtrak",
    "abbreviation": "AMTK",
    "country": "United States",
    "country_code": "US",
    "status": "active",
    "full_registered_name": "National Railroad Passenger Corporation",
    "company_type": "government-owned corporation",
    "founded_year": 1971,
    "defunct_year": null,
    "website": "https://www.amtrak.com"
  },
  {
    "name": "BNSF Railway",
    "abbreviation": "BNSF",
    "country": "United States",
    "country_code": "US",
    "status": "active",
    "full_registered_name": "BNSF Railway Company",
    "company_type": "freight railroad",
    "founded_year": 1995,
    "defunct_year": null,
    "website": "https://www.bnsf.com"
  },
  {
    "name": "Български държавни железници",
    "abbreviation": "BDZ",
    "country": "Bulgaria",
    "country_code": "BG",
    "status": "active",
    "full_registered_name": "Български държавни железници (Bulgarian State Railways)",
    "company_type": "state-owned railway company",
    "founded_year": 1888,
    "defunct_year": null,
    "website": "https://www.bdz.bg"
  },
  {
    "name": "British Rail",
    "abbreviation": "BR",
    "country": "United Kingdom",
    "country_code": "GB",
    "status": "defunct",
    "full_registered_name": "British Railways Board",
    "company_type": "state-owned railway company",
    "founded_year": 1948,
    "defunct_year": 1997,
    "website": null
  },
  {
    "name": "Căile Ferate Române",
    "abbreviation": "CFR",
    "country": "Romania",
    "country_code": "RO",
    "status": "active",
    "full_registered_name": "Căile Ferate Române",
    "company_type": "state-owned railway company",
    "founded_year": 1880,
    "defunct_year": null,
    "website": "https://www.cfrcalatori.ro"
  },
  {
    "name": "České dráhy",
    "abbreviation": "ČD",
    "country": "Czech Republic",
    "country_code": "CZ",
    "status": "active",
    "full_registered_name": "České dráhy, a.s.",
    "company_type": "state-owned railway company",
    "founded_year": 1993,
    "defunct_year": null,
    "website": "https://www.cd.cz"
  },
  {
    "name": "Comboios de Portugal",
    "abbreviation": "CP",
    "country": "Portugal",
    "country_code": "PT",
    "status": "active",
    "full_registered_name": "Comboios de Portugal, E.P.E.",
    "company_type": "state-owned railway company",
    "founded_year": 1860,
    "defunct_year": null,
    "website": "https://www.cp.pt"
  },
  {
    "name": "Compagnie des Chemins de fer du Nord",
    "abbreviation": "Nord",
    "country": "France",
    "country_code": "FR",
    "status": "defunct",
    "full_registered_name": "Compagnie des chemins de fer du Nord",
    "company_type": "private railway company",
    "founded_year": 1845,
    "defunct_year": 1937,
    "website": null
  },
  {
    "name": "CSX Transportation",
    "abbreviation": "CSX",
    "country": "United States",
    "country_code": "US",
    "status": "active",
    "full_registered_name": "CSX Transportation, Inc.",
    "company_type": "freight railroad",
    "founded_year": 1986,
    "defunct_year": null,
    "website": "https://www.csx.com"
  },
  {
    "name": "Danske Statsbaner",
    "abbreviation": "DSB",
    "country": "Denmark",
    "country_code": "DK",
    "status": "active",
    "full_registered_name": "Danske Statsbaner",
    "company_type": "state-owned railway company",
    "founded_year": 1885,
    "defunct_year": null,
    "website": "https://www.dsb.dk"
  },
  {
    "name": "Deutsche Bahn",
    "abbreviation": "DB",
    "country": "Germany",
    "country_code": "DE",
    "status": "active",
    "full_registered_name": "Deutsche Bahn AG",
    "company_type": "state-owned railway company",
    "founded_year": 1994,
    "defunct_year": null,
    "website": "https://www.deutschebahn.com"
  },
  {
    "name": "Ferrovie dello Stato Italiane",
    "abbreviation": "FS",
    "country": "Italy",
    "country_code": "IT",
    "status": "active",
    "full_registered_name": "Ferrovie dello Stato Italiane S.p.A.",
    "company_type": "state-owned railway company",
    "founded_year": 1905,
    "defunct_year": null,
    "website": "https://www.fsitaliane.it"
  },
  {
    "name": "Hrvatske željeznice",
    "abbreviation": "HŽ",
    "country": "Croatia",
    "country_code": "HR",
    "status": "active",
    "full_registered_name": "Hrvatske željeznice d.o.o.",
    "company_type": "state-owned railway company",
    "founded_year": 1991,
    "defunct_year": null,
    "website": "https://www.hzpp.hr"
  },
  {
    "name": "Iarnród Éireann",
    "abbreviation": "IE",
    "country": "Ireland",
    "country_code": "IE",
    "status": "active",
    "full_registered_name": "Iarnród Éireann (Irish Rail)",
    "company_type": "state-owned railway company",
    "founded_year": 1987,
    "defunct_year": null,
    "website": "https://www.irishrail.ie"
  },
  {
    "name": "Japanese National Railways",
    "abbreviation": "JNR",
    "country": "Japan",
    "country_code": "JP",
    "status": "defunct",
    "full_registered_name": "Japanese National Railways",
    "company_type": "state-owned railway company",
    "founded_year": 1949,
    "defunct_year": 1987,
    "website": null
  },
  {
    "name": "JR Central",
    "abbreviation": "JR Central",
    "country": "Japan",
    "country_code": "JP",
    "status": "active",
    "full_registered_name": "Central Japan Railway Company",
    "company_type": "private railway company",
    "founded_year": 1987,
    "defunct_year": null,
    "website": "https://global.jr-central.co.jp/en/"
  },
  {
    "name": "JR East",
    "abbreviation": "JR East",
    "country": "Japan",
    "country_code": "JP",
    "status": "active",
    "full_registered_name": "East Japan Railway Company",
    "company_type": "private railway company",
    "founded_year": 1987,
    "defunct_year": null,
    "website": "https://www.jreast.co.jp"
  },
  {
    "name": "JR Hokkaido",
    "abbreviation": "JR Hokkaido",
    "country": "Japan",
    "country_code": "JP",
    "status": "active",
    "full_registered_name": "Hokkaido Railway Company",
    "company_type": "private railway company",
    "founded_year": 1987,
    "defunct_year": null,
    "website": "https://www.jrhokkaido.co.jp/global/"
  },
  {
    "name": "JR Kyushu",
    "abbreviation": "JR Kyushu",
    "country": "Japan",
    "country_code": "JP",
    "status": "active",
    "full_registered_name": "Kyushu Railway Company",
    "company_type": "private railway company",
    "founded_year": 1987,
    "defunct_year": null,
    "website": "https://www.jrkyushu.co.jp/english/"
  },
  {
    "name": "JR Shikoku",
    "abbreviation": "JR Shikoku",
    "country": "Japan",
    "country_code": "JP",
    "status": "active",
    "full_registered_name": "Shikoku Railway Company",
    "company_type": "private railway company",
    "founded_year": 1987,
    "defunct_year": null,
    "website": "https://www.jr-shikoku.co.jp/global/en/"
  },
  {
    "name": "JR West",
    "abbreviation": "JR West",
    "country": "Japan",
    "country_code": "JP",
    "status": "active",
    "full_registered_name": "West Japan Railway Company",
    "company_type": "private railway company",
    "founded_year": 1987,
    "defunct_year": null,
    "website": "https://www.westjr.co.jp/global/en/"
  },
  {
    "name": "London and North Eastern Railway",
    "abbreviation": "LNER",
    "country": "United Kingdom",
    "country_code": "GB",
    "status": "defunct",
    "full_registered_name": "London and North Eastern Railway Company",
    "company_type": "private railway company",
    "founded_year": 1923,
    "defunct_year": 1948,
    "website": null
  },
  {
    "name": "Magyar Államvasutak",
    "abbreviation": "MÁV",
    "country": "Hungary",
    "country_code": "HU",
    "status": "active",
    "full_registered_name": "Magyar Államvasutak Zrt.",
    "company_type": "state-owned railway company",
    "founded_year": 1868,
    "defunct_year": null,
    "website": "https://www.mavcsoport.hu"
  },
  {
    "name": "Nederlandse Spoorwegen",
    "abbreviation": "NS",
    "country": "Netherlands",
    "country_code": "NL",
    "status": "active",
    "full_registered_name": "Nederlandse Spoorwegen N.V.",
    "company_type": "state-owned railway company",
    "founded_year": 1938,
    "defunct_year": null,
    "website": "https://www.ns.nl"
  },
  {
    "name": "Organismos Sidirodromon Ellados",
    "abbreviation": "OSE",
    "country": "Greece",
    "country_code": "GR",
    "status": "active",
    "full_registered_name": "Organismos Sidirodromon Ellados",
    "company_type": "state-owned railway company",
    "founded_year": 1971,
    "defunct_year": null,
    "website": "https://www.ose.gr"
  },
  {
    "name": "Österreichische Bundesbahnen",
    "abbreviation": "ÖBB",
    "country": "Austria",
    "country_code": "AT",
    "status": "active",
    "full_registered_name": "Austrian Federal Railways",
    "company_type": "state-owned railway company",
    "founded_year": 1923,
    "defunct_year": null,
    "website": "https://www.oebb.at"
  },
  {
    "name": "Polskie Koleje Państwowe",
    "abbreviation": "PKP",
    "country": "Poland",
    "country_code": "PL",
    "status": "active",
    "full_registered_name": "Polskie Koleje Państwowe S.A.",
    "company_type": "state-owned railway company",
    "founded_year": 1926,
    "defunct_year": null,
    "website": "https://www.pkp.pl"
  },
  {
    "name": "Rail Traction Company",
    "abbreviation": "RTC",
    "country": "Italy",
    "country_code": "IT",
    "status": "active",
    "full_registered_name": "Rail Traction Company S.p.A.",
    "company_type": "private railway company (freight)",
    "founded_year": 2000,
    "defunct_year": null,
    "website": "https://www.rtcsrl.it"
  },
  {
    "name": "Renfe Operadora",
    "abbreviation": "RENFE",
    "country": "Spain",
    "country_code": "ES",
    "status": "active",
    "full_registered_name": "Renfe-Operadora (successor of RENFE)",
    "company_type": "state-owned train operator",